17:06:30.589573 IP 10.249.7.81.mysql > 10.249.16.225.40526: Flags [.], ack 3081418594, win 114, options [nop,nop,TS val 1485940078 ecr 21548134], length 0
E..4h.@.?...
..Q
......NA..-...b...rR......
X..n.H.f
17:06:30.591517 IP 10.249.7.81.mysql > 10.249.16.225.40526: Flags [P.], seq 0:11, ack 1, win 114, options [nop,nop,TS val 1485940078 ecr 21548134], length 11
E..?h.@.?...
..Q
......NA..-...b...rK......
X..n.H.f...........
17:06:30.591739 IP 10.249.16.225.40526 > 10.249.7.81.mysql: Flags [P.], seq 1:184, ack 11, win 229, options [nop,nop,TS val 21548138 ecr 1485940078], length 183
E...{c@.@...
...
..Q.N.....bA..8..../......
.H.jX..n.....SELECT * FROM `cms_school` WHERE `city_id` = '11' AND `type` = 'jk3oQnLB\\\';update newhome_db.cms_school set type = 1 where id = 211; -- ' AND (status != '0') LIMIT 10 OFFSET 0 
17:06:30.607835 IP 10.249.7.81.mysql > 10.249.16.225.40526: Flags [P.], seq 11:2243, ack 184, win 122, options [nop,nop,TS val 1485940080 ecr 21548138], length 2232
E...h.@.?..?
..Q
......NA..8.......z7......
X..p.H.j.....8....def
newhome_db
cms_school
cms_school.id.id.?......#B...@....def
newhome_db
cms_school
cms_school.status.status.?...... ....B....def
newhome_db
cms_school
cms_school.city_id.city_id.?......)@...@....def
newhome_db
cms_school
cms_school.unikey.unikey.!.......P...<....def
newhome_db
cms_school
cms_school.type.type.?......!@...<....def
newhome_db
cms_school
cms_school.name.name.!...........>....def
newhome_db
cms_school
cms_school.alias.alias.!...........F..	.def
newhome_db
cms_school
cms_school	region_id	region_id.?......!@...B..
.def
newhome_db
cms_school
cms_school.address.address.!...........B....def
newhome_db
cms_school
cms_school.zipcode.zipcode.!...........B....def
newhome_db
cms_school
cms_school.siteurl.siteurl.!...........D...def
newhome_db
cms_school
cms_school.property.property.?......!@...F....def
newhome_db
cms_school
cms_school	attribute	attribute.!...........>....def
newhome_db
cms_school
cms_school.grade.grade.?......!@...F....def
newhome_db
cms_school
cms_school	telephone	telephone.!.<.........B....def
newhome_db
cms_school
cms_school.summary.summary.!...........>....def
newhome_db
cms_school
cms_school.range.range.!...........B....def
newhome_db
cms_school
cms_school.feature.feature.!...........R....def
newhome_db
cms_school
cms_school.feature_summary.feature_summary.!...........F....def
newhome_db
cms_school
cms_school	baidu_lat	baidu_lat.?......!....F....def
newhome_db
cms_school
cms_school	baidu_lng	baidu_lng.?......!....:....def
newhome_db
cms_school
cms_school.lat.lat.?......!....:....def
newhome_db
cms_school
cms_school.lng.lng.?......!.............Y....212.1.11.delete.0.............1999..0....2..3(021)62194509....	31.207472
121.420374.0.0U....213.1.11.88.0.............1.....0....2..3(021)62194509....	31.207472
121.420374.0.0`....215.1.11.1133.01..............0....2......|.......3.021-62194509....	31.207472
121.420374.0.0g....226.1.11.11833.0e..............0....2.............|.......3.021-62194509....	31.207472
121.420374.0.0g....235.1.11.88990.0e..............0....2.............|.......3.021-62194509....	31.207472
121.420374.0.0s....244.1.11.88990888.0e..............0....2........3.021-62194509............|.............	31.207472
121.420374.0.0... .....
17:06:30.607884 IP 10.249.16.225.40526 > 10.249.7.81.mysql: Flags [.], ack 2243, win 263, options [nop,nop,TS val 21548142 ecr 1485940080], length 0
E..4{d@.@..<
...
..Q.N......A........J.....
.H.nX..p
17:06:30.609158 IP 10.249.16.225.40526 > 10.249.7.81.mysql: Flags [P.], seq 184:189, ack 2243, win 263, options [nop,nop,TS val 21548143 ecr 1485940080], length 5
E..9{e@.@..6
...
..Q.N......A........O.....
.H.oX..p.....
17:06:30.609263 IP 10.249.16.225.40526 > 10.249.7.81.mysql: Flags [F.], seq 189, ack 2243, win 263, options [nop,nop,TS val 21548143 ecr 1485940080], length 0
E..4{f@.@..:
...
..Q.N......A........J.....
.H.oX..p
17:06:30.612694 IP 10.249.7.81.mysql > 10.249.16.225.40526: Flags [F.], seq 2243, ack 189, win 122, options [nop,nop,TS val 1485940084 ecr 21548143], length 0
E..4h.@.?...
..Q
......NA..........zH......
X..t.H.o
17:06:30.612731 IP 10.249.16.225.40526 > 10.249.7.81.mysql: Flags [.], ack 2244, win 263, options [nop,nop,TS val 21548144 ecr 1485940084], length 0
E..4{g@.@..9
...
..Q.N......A........J.....
.H.pX..t
17:06:30.612810 IP 10.249.7.81.mysql > 10.249.16.225.40526: Flags [.], ack 190, win 122, options [nop,nop,TS val 1485940084 ecr 21548143], length 0
E..4h.@.?...
..Q
......NA..........zH......
X..t.H.o
17:08:51.933394 IP 10.249.16.225.40534 > 10.249.7.81.mysql: Flags [S], seq 2262464687, win 29200, options [mss 1460,sackOK,TS val 21583474 ecr 0,nop,wscale 7], length 0
E..<..@.@...
...
..Q.V....x.......r..R.........
.IVr........
17:08:51.936505 IP 10.249.7.81.mysql > 10.249.16.225.40534: Flags [S.], seq 300861859, ack 2262464688, win 14480, options [mss 1386,sackOK,TS val 1485975419 ecr 21583474,nop,wscale 7], length 0
E..<..@.?..
..Q
......V......x...8.{`.....j...
X./{.IVr....
17:08:51.936563 IP 10.249.16.225.40534 > 10.249.7.81.mysql: Flags [.], ack 1, win 229, options [nop,nop,TS val 21583475 ecr 1485975419], length 0
E..4..@.@...
...
..Q.V....x..........J.....
.IVsX./{
17:08:51.941120 IP 10.249.7.81.mysql > 10.249.16.225.40534: Flags [P.], seq 1:96, ack 1, win 114, options [nop,nop,TS val 1485975420 ecr 21583475], length 95
E.....@.?.&i
..Q
......V......x....r1'.....
X./|.IVs[...
5.5.40-0ubuntu0.12.04.1.....T3A.^sGI...................u6JO1FK'!m$f.mysql_native_password.
17:08:51.941190 IP 10.249.16.225.40534 > 10.249.7.81.mysql: Flags [.], ack 96, win 229, options [nop,nop,TS val 21583476 ecr 1485975420], length 0
E..4..@.@...
...
..Q.V....x..........J.....
.IVtX./|
17:08:51.941433 IP 10.249.16.225.40534 > 10.249.7.81.mysql: Flags [P.], seq 1:98, ack 96, win 229, options [nop,nop,TS val 21583476 ecr 1485975420], length 97
E.....@.@.._
...
..Q.V....x................
.IVtX./|]...........!.......................aifang....QZ...4......)....newhome_db.mysql_native_password.
17:08:51.951681 IP 10.249.7.81.mysql > 10.249.16.225.40534: Flags [.], ack 98, win 114, options [nop,nop,TS val 1485975423 ecr 21583476], length 0
E..4..@.?.&.
..Q
......V......y....r.:.....
X./..IVt
17:08:51.951698 IP 10.249.7.81.mysql > 10.249.16.225.40534: Flags [P.], seq 96:107, ack 98, win 114, options [nop,nop,TS val 1485975423 ecr 21583476], length 11
E..?..@.?.&.
..Q
......V......y....r.#.....
X./..IVt...........
17:08:51.951915 IP 10.249.16.225.40534 > 10.249.7.81.mysql: Flags [P.], seq 98:281, ack 107, win 229, options [nop,nop,TS val 21583478 ecr 1485975423], length 183
E.....@.@...
...
..Q.V....y........./......
.IVvX./......SELECT * FROM `cms_school` WHERE `city_id` = '11' AND `type` = 'jk3oQnLB\\\';update newhome_db.cms_school set type = 1 where id = 211; -- ' AND (status != '0') LIMIT 10 OFFSET 0 
17:08:51.954681 IP 10.249.7.81.mysql > 10.249.16.225.40534: Flags [.], seq 107:1481, ack 281, win 122, options [nop,nop,TS val 1485975424 ecr 21583478], length 1374
E.....@.?.!g
..Q
......V......y....z4S.....
X./..IVv.....8....def
newhome_db
cms_school
cms_school.id.id.?......#B...@....def
newhome_db
cms_school
cms_school.status.status.?...... ....B....def
newhome_db
cms_school
cms_school.city_id.city_id.?......)@...@....def
newhome_db
cms_school
cms_school.unikey.unikey.!.......P...<....def
newhome_db
cms_school
cms_school.type.type.?......!@...<....def
newhome_db
cms_school
cms_school.name.name.!...........>....def
newhome_db
cms_school
cms_school.alias.alias.!...........F..	.def
newhome_db
cms_school
cms_school	region_id	region_id.?......!@...B..
.def
newhome_db
cms_school
cms_school.address.address.!...........B....def
newhome_db
cms_school
cms_school.zipcode.zipcode.!...........B....def
newhome_db
cms_school
cms_school.siteurl.siteurl.!...........D...def
newhome_db
cms_school
cms_school.property.property.?......!@...F....def
newhome_db
cms_school
cms_school	attribute	attribute.!...........>....def
newhome_db
cms_school
cms_school.grade.grade.?......!@...F....def
newhome_db
cms_school
cms_school	telephone	telephone.!.<.........B....def
newhome_db
cms_school
cms_school.summary.summary.!...........>....def
newhome_db
cms_school
cms_school.range.range.!...........B....def
newhome_db
cms_school
cms_school.feature.feature.!...........R....def
newhome_db
cms_school
cms_school.feature_summary.feature_summary.!...........F....def
newhome_db
cms_school
cms_school	baidu
17:08:51.956528 IP 10.249.7.81.mysql > 10.249.16.225.40534: Flags [P.], seq 1481:2339, ack 281, win 122, options [nop,nop,TS val 1485975424 ecr 21583478], length 858
E.....@.?.#j
..Q
......V...l..y....z.%.....
X./..IVv_lat	baidu_lat.?......!....F....def
newhome_db
cms_school
cms_school	baidu_lng	baidu_lng.?......!....:....def
newhome_db
cms_school
cms_school.lat.lat.?......!....:....def
newhome_db
cms_school
cms_school.lng.lng.?......!.............Y....212.1.11.delete.0.............1999..0....2..3(021)62194509....	31.207472
121.420374.0.0U....213.1.11.88.0.............1.....0....2..3(021)62194509....	31.207472
121.420374.0.0`....215.1.11.1133.01..............0....2......|.......3.021-62194509....	31.207472
121.420374.0.0g....226.1.11.11833.0e..............0....2.............|.......3.021-62194509....	31.207472
121.420374.0.0g....235.1.11.88990.0e..............0....2.............|.......3.021-62194509....	31.207472
121.420374.0.0s....244.1.11.88990888.0e..............0....2........3.021-62194509............|.............	31.207472
121.420374.0.0... .....
17:08:51.956548 IP 10.249.16.225.40534 > 10.249.7.81.mysql: Flags [.], ack 2339, win 273, options [nop,nop,TS val 21583480 ecr 1485975424], length 0
E..4..@.@...
...
..Q.V....y..........J.....
.IVxX./.
17:08:51.960539 IP 10.249.16.225.40534 > 10.249.7.81.mysql: Flags [P.], seq 281:286, ack 2339, win 273, options [nop,nop,TS val 21583481 ecr 1485975424], length 5
E..9..@.@...
...
..Q.V....y..........O.....
.IVyX./......
17:08:51.960689 IP 10.249.16.225.40534 > 10.249.7.81.mysql: Flags [F.], seq 286, ack 2339, win 273, options [nop,nop,TS val 21583481 ecr 1485975424], length 0
E..4..@.@...
...
..Q.V....y..........J.....
.IVyX./.
17:08:51.964306 IP 10.249.7.81.mysql > 10.249.16.225.40534: Flags [F.], seq 2339, ack 286, win 122, options [nop,nop,TS val 1485975426 ecr 21583481], length 0
E..4..@.?.&.
..Q
......V......y....z.......
X./..IVy
17:08:51.964328 IP 10.249.16.225.40534 > 10.249.7.81.mysql: Flags [.], ack 2340, win 273, options [nop,nop,TS val 21583482 ecr 1485975426], length 0
E..4..@.@...
...
..Q.V....y..........J.....
.IVzX./.
17:08:51.969193 IP 10.249.7.81.mysql > 10.249.16.225.40534: Flags [.], ack 287, win 122, options [nop,nop,TS val 1485975428 ecr 21583481], length 0
E..4..@.?.&.
..Q
......V......y....z.......
X./..IVy
17:23:42.022571 IP 10.249.16.225.40540 > 10.249.7.81.mysql: Flags [S], seq 2032646051, win 29200, options [mss 1460,sackOK,TS val 21805996 ecr 0,nop,wscale 7], length 0
E..<..@.@...
...
..Q.\..y'........r..R.........
.L..........
17:23:42.026073 IP 10.249.7.81.mysql > 10.249.16.225.40540: Flags [S.], seq 799932158, ack 2032646052, win 14480, options [mss 1386,sackOK,TS val 1486197970 ecr 21805996,nop,wscale 7], length 0
E..<..@.?..
..Q
......\/...y'....8.,g.....j...
X....L......
17:23:42.026100 IP 10.249.16.225.40540 > 10.249.7.81.mysql: Flags [.], ack 1, win 229, options [nop,nop,TS val 21805997 ecr 1486197970], length 0
E..4..@.@...
...
..Q.\..y'../........J.....
.L..X...
17:23:42.030187 IP 10.249.7.81.mysql > 10.249.16.225.40540: Flags [P.], seq 1:96, ack 1, win 114, options [nop,nop,TS val 1486197971 ecr 21805997], length 95
E...j,@.?...
..Q
......\/...y'.....rS......
X....L..[...
5.5.40-0ubuntu0.12.04.1.....YH>>]9E/...................ZV$N>,]qB4z0.mysql_native_password.
17:23:42.030197 IP 10.249.16.225.40540 > 10.249.7.81.mysql: Flags [.], ack 96, win 229, options [nop,nop,TS val 21805998 ecr 1486197971], length 0
E..4..@.@...
...
..Q.\..y'../..^.....J.....
.L..X...
17:23:42.030295 IP 10.249.16.225.40540 > 10.249.7.81.mysql: Flags [P.], seq 1:98, ack 96, win 229, options [nop,nop,TS val 21805998 ecr 1486197971], length 97
E.....@.@...
...
..Q.\..y'../..^...........
.L..X...]...........!.......................aifang..2.y..^Y....}.Y'.iA1.newhome_db.mysql_native_password.
17:23:42.035052 IP 10.249.7.81.mysql > 10.249.16.225.40540: Flags [.], ack 98, win 114, options [nop,nop,TS val 1486197972 ecr 21805998], length 0
E..4j-@.?..s
..Q
......\/..^y'.....r.C.....
X....L..
17:23:42.035059 IP 10.249.7.81.mysql > 10.249.16.225.40540: Flags [P.], seq 96:107, ack 98, win 114, options [nop,nop,TS val 1486197972 ecr 21805998], length 11
E..?j.@.?..g
..Q
......\/..^y'.....r.,.....
X....L.............
17:23:42.035127 IP 10.249.16.225.40540 > 10.249.7.81.mysql: Flags [P.], seq 98:279, ack 107, win 229, options [nop,nop,TS val 21805999 ecr 1486197972], length 181
E.....@.@...
...
..Q.\..y'../..i...........
.L..X........SELECT * FROM `cms_school` WHERE `city_id` = '11' AND `type` = 'jk3oQnLB\';update newhome_db.cms_school set type = 1 where id = 211; -- ' AND (status != '0') LIMIT 10 OFFSET 0 
17:23:42.038404 IP 10.249.7.81.mysql > 10.249.16.225.40540: Flags [.], seq 107:1481, ack 279, win 122, options [nop,nop,TS val 1486197974 ecr 21805999], length 1374
E...j/@.?...
..Q
......\/..iy'.....z.].....
X....L.......8....def
newhome_db
cms_school
cms_school.id.id.?......#B...@....def
newhome_db
cms_school
cms_school.status.status.?...... ....B....def
newhome_db
cms_school
cms_school.city_id.city_id.?......)@...@....def
newhome_db
cms_school
cms_school.unikey.unikey.!.......P...<....def
newhome_db
cms_school
cms_school.type.type.?......!@...<....def
newhome_db
cms_school
cms_school.name.name.!...........>....def
newhome_db
cms_school
cms_school.alias.alias.!...........F..	.def
newhome_db
cms_school
cms_school	region_id	region_id.?......!@...B..
.def
newhome_db
cms_school
cms_school.address.address.!...........B....def
newhome_db
cms_school
cms_school.zipcode.zipcode.!...........B....def
newhome_db
cms_school
cms_school.siteurl.siteurl.!...........D...def
newhome_db
cms_school
cms_school.property.property.?......!@...F....def
newhome_db
cms_school
cms_school	attribute	attribute.!...........>....def
newhome_db
cms_school
cms_school.grade.grade.?......!@...F....def
newhome_db
cms_school
cms_school	telephone	telephone.!.<.........B....def
newhome_db
cms_school
cms_school.summary.summary.!...........>....def
newhome_db
cms_school
cms_school.range.range.!...........B....def
newhome_db
cms_school
cms_school.feature.feature.!...........R....def
newhome_db
cms_school
cms_school.feature_summary.feature_summary.!...........F....def
newhome_db
cms_school
cms_school	baidu
17:23:42.039794 IP 10.249.7.81.mysql > 10.249.16.225.40540: Flags [P.], seq 1481:2428, ack 279, win 122, options [nop,nop,TS val 1486197974 ecr 21805999], length 947
E...j0@.?...
..Q
......\/...y'.....z.......
X....L.._lat	baidu_lat.?......!....F....def
newhome_db
cms_school
cms_school	baidu_lng	baidu_lng.?......!....:....def
newhome_db
cms_school
cms_school.lat.lat.?......!....:....def
newhome_db
cms_school
cms_school.lng.lng.?......!.............U....211.1.11.90.0.............1999..0....2..3(021)62194509....	31.207472
121.420374.0.0Y....212.1.11.delete.0.............1999..0....2..3(021)62194509....	31.207472
121.420374.0.0U....213.1.11.88.0.............1.....0....2..3(021)62194509....	31.207472
121.420374.0.0`....215.1.11.1133.01..............0....2......|.......3.021-62194509....	31.207472
121.420374.0.0g....226.1.11.11833.0e..............0....2.............|.......3.021-62194509....	31.207472
121.420374.0.0g....235.1.11.88990.0e..............0....2.............|.......3.021-62194509....	31.207472
121.420374.0.0s.. .244.1.11.88990888.0e..............0....2........3.021-62194509............|.............	31.207472
121.420374.0.0...!.....
17:23:42.039803 IP 10.249.16.225.40540 > 10.249.7.81.mysql: Flags [.], ack 2428, win 273, options [nop,nop,TS val 21806000 ecr 1486197974], length 0
E..4..@.@...
...
..Q.\..y'../..z.....J.....
.L..X...
17:23:42.044159 IP 10.249.16.225.40540 > 10.249.7.81.mysql: Flags [P.], seq 279:284, ack 2428, win 273, options [nop,nop,TS val 21806001 ecr 1486197974], length 5
E..9..@.@...
...
..Q.\..y'../..z.....O.....
.L..X........
17:23:42.044268 IP 10.249.16.225.40540 > 10.249.7.81.mysql: Flags [F.], seq 284, ack 2428, win 273, options [nop,nop,TS val 21806002 ecr 1486197974], length 0
E..4..@.@...
...
..Q.\..y'../..z.....J.....
.L..X...
17:23:42.046817 IP 10.249.7.81.mysql > 10.249.16.225.40540: Flags [F.], seq 2428, ack 284, win 122, options [nop,nop,TS val 1486197976 ecr 21806001], length 0
E..4j1@.?..o
..Q
......\/..zy'.....z.].....
X....L..
17:23:42.046842 IP 10.249.16.225.40540 > 10.249.7.81.mysql: Flags [.], ack 2429, win 273, options [nop,nop,TS val 21806002 ecr 1486197976], length 0
E..4..@.@...
...
..Q.\..y'../..{.....J.....
.L..X...
17:23:42.046926 IP 10.249.7.81.mysql > 10.249.16.225.40540: Flags [.], ack 285, win 122, options [nop,nop,TS val 1486197976 ecr 21806002], length 0
E..4j2@.?..n
..Q
......\/..{y'.....z.[.....
X....L..
17:26:50.566214 IP 10.249.16.225.40542 > 10.249.7.81.mysql: Flags [S], seq 3548134691, win 29200, options [mss 1460,sackOK,TS val 21853132 ecr 0,nop,wscale 7], length 0
E..<N.@.@...
...
..Q.^...|=#......r..R.........
.Ms.........
17:26:50.571284 IP 10.249.7.81.mysql > 10.249.16.225.40542: Flags [S.], seq 2801360448, ack 3548134692, win 14480, options [mss 1386,sackOK,TS val 1486245112 ecr 21853132,nop,wscale 7], length 0
E..<..@.?..
..Q
......^..^@.|=$..8........j...
X.L..Ms.....
17:26:50.571385 IP 10.249.16.225.40542 > 10.249.7.81.mysql: Flags [.], ack 1, win 229, options [nop,nop,TS val 21853133 ecr 1486245112], length 0
E..4N.@.@...
...
..Q.^...|=$..^A.....J.....
.Ms.X.L.
17:26:50.576241 IP 10.249.7.81.mysql > 10.249.16.225.40542: Flags [P.], seq 1:96, ack 1, win 114, options [nop,nop,TS val 1486245114 ecr 21853133], length 95
E.....@.?...
..Q
......^..^A.|=$...r@	.....
X.L..Ms.[...
5.5.40-0ubuntu0.12.04.1.....xZ8F7!?Y...................#@Y|(M.:wl7i.mysql_native_password.
17:26:50.576495 IP 10.249.16.225.40542 > 10.249.7.81.mysql: Flags [.], ack 96, win 229, options [nop,nop,TS val 21853135 ecr 1486245114], length 0
E..4N.@.@...
...
..Q.^...|=$..^......J.....
.Ms.X.L.
17:26:50.576695 IP 10.249.16.225.40542 > 10.249.7.81.mysql: Flags [P.], seq 1:98, ack 96, win 229, options [nop,nop,TS val 21853135 ecr 1486245114], length 97
E...N.@.@..M
...
..Q.^...|=$..^............
.Ms.X.L.]...........!.......................aifang..X..6m...8.O../......newhome_db.mysql_native_password.
17:26:50.604187 IP 10.249.7.81.mysql > 10.249.16.225.40542: Flags [.], ack 98, win 114, options [nop,nop,TS val 1486245116 ecr 21853135], length 0
E..4..@.?...
..Q
......^..^..|=....rk......
X.L..Ms.
17:26:50.604205 IP 10.249.7.81.mysql > 10.249.16.225.40542: Flags [P.], seq 96:107, ack 98, win 114, options [nop,nop,TS val 1486245116 ecr 21853135], length 11
E..?..@.?...
..Q
......^..^..|=....rd}.....
X.L..Ms............
17:26:50.604718 IP 10.249.16.225.40542 > 10.249.7.81.mysql: Flags [P.], seq 98:279, ack 107, win 229, options [nop,nop,TS val 21853142 ecr 1486245116], length 181
E...N.@.@...
...
..Q.^...|=...^............
.Ms.X.L......SELECT * FROM `cms_school` WHERE `city_id` = '11' AND `type` = 'jk3oQnLB\';update newhome_db.cms_school set type = 1 where id = 211; -- ' AND (status != '0') LIMIT 10 OFFSET 0 
17:26:50.615664 IP 10.249.7.81.mysql > 10.249.16.225.40542: Flags [.], seq 107:1481, ack 279, win 122, options [nop,nop,TS val 1486245123 ecr 21853142], length 1374
E.....@.?...
..Q
......^..^..|>:...z.......
X.M..Ms......8....def
newhome_db
cms_school
cms_school.id.id.?......#B...@....def
newhome_db
cms_school
cms_school.status.status.?...... ....B....def
newhome_db
cms_school
cms_school.city_id.city_id.?......)@...@....def
newhome_db
cms_school
cms_school.unikey.unikey.!.......P...<....def
newhome_db
cms_school
cms_school.type.type.?......!@...<....def
newhome_db
cms_school
cms_school.name.name.!...........>....def
newhome_db
cms_school
cms_school.alias.alias.!...........F..	.def
newhome_db
cms_school
cms_school	region_id	region_id.?......!@...B..
.def
newhome_db
cms_school
cms_school.address.address.!...........B....def
newhome_db
cms_school
cms_school.zipcode.zipcode.!...........B....def
newhome_db
cms_school
cms_school.siteurl.siteurl.!...........D...def
newhome_db
cms_school
cms_school.property.property.?......!@...F....def
newhome_db
cms_school
cms_school	attribute	attribute.!...........>....def
newhome_db
cms_school
cms_school.grade.grade.?......!@...F....def
newhome_db
cms_school
cms_school	telephone	telephone.!.<.........B....def
newhome_db
cms_school
cms_school.summary.summary.!...........>....def
newhome_db
cms_school
cms_school.range.range.!...........B....def
newhome_db
cms_school
cms_school.feature.feature.!...........R....def
newhome_db
cms_school
cms_school.feature_summary.feature_summary.!...........F....def
newhome_db
cms_school
cms_school	baidu
17:26:50.616644 IP 10.249.7.81.mysql > 10.249.16.225.40542: Flags [P.], seq 1481:2428, ack 279, win 122, options [nop,nop,TS val 1486245123 ecr 21853142], length 947
E.....@.?...
..Q
......^..d	.|>:...z.......
X.M..Ms._lat	baidu_lat.?......!....F....def
newhome_db
cms_school
cms_school	baidu_lng	baidu_lng.?......!....:....def
newhome_db
cms_school
cms_school.lat.lat.?......!....:....def
newhome_db
cms_school
cms_school.lng.lng.?......!.............U....211.1.11.90.0.............1999..0....2..3(021)62194509....	31.207472
121.420374.0.0Y....212.1.11.delete.0.............1999..0....2..3(021)62194509....	31.207472
121.420374.0.0U....213.1.11.88.0.............1.....0....2..3(021)62194509....	31.207472
121.420374.0.0`....215.1.11.1133.01..............0....2......|.......3.021-62194509....	31.207472
121.420374.0.0g....226.1.11.11833.0e..............0....2.............|.......3.021-62194509....	31.207472
121.420374.0.0g....235.1.11.88990.0e..............0....2.............|.......3.021-62194509....	31.207472
121.420374.0.0s.. .244.1.11.88990888.0e..............0....2........3.021-62194509............|.............	31.207472
121.420374.0.0...!.....
17:26:50.616666 IP 10.249.16.225.40542 > 10.249.7.81.mysql: Flags [.], ack 2428, win 273, options [nop,nop,TS val 21853145 ecr 1486245123], length 0
E..4N.@.@...
...
..Q.^...|>:..g......J.....
.Ms.X.M.
17:26:50.618096 IP 10.249.16.225.40542 > 10.249.7.81.mysql: Flags [P.], seq 279:284, ack 2428, win 273, options [nop,nop,TS val 21853145 ecr 1486245123], length 5
E..9N.@.@...
...
..Q.^...|>:..g......O.....
.Ms.X.M......
17:26:50.618215 IP 10.249.16.225.40542 > 10.249.7.81.mysql: Flags [F.], seq 284, ack 2428, win 273, options [nop,nop,TS val 21853145 ecr 1486245123], length 0
E..4N.@.@...
...
..Q.^...|>?..g......J.....
.Ms.X.M.
17:26:50.640575 IP 10.249.16.225.40542 > 10.249.7.81.mysql: Flags [F.], seq 284, ack 2428, win 273, options [nop,nop,TS val 21853151 ecr 1486245123], length 0
E..4N.@.@...
...
..Q.^...|>?..g......J.....
.Ms.X.M.
17:26:50.656218 IP 10.249.7.81.mysql > 10.249.16.225.40542: Flags [F.], seq 2428, ack 284, win 122, options [nop,nop,TS val 1486245134 ecr 21853145], length 0
E..4..@.?...
..Q
......^..g..|>?...za......
X.M..Ms.
17:26:50.656266 IP 10.249.16.225.40542 > 10.249.7.81.mysql: Flags [.], ack 2429, win 273, options [nop,nop,TS val 21853155 ecr 1486245134], length 0
E..4N.@.@...
...
..Q.^...|>@..g......J.....
.Ms.X.M.
17:26:50.658667 IP 10.249.7.81.mysql > 10.249.16.225.40542: Flags [.], ack 285, win 122, options [nop,nop,TS val 1486245134 ecr 21853145], length 0
E..4..@.?...
..Q
......^..g..|>@...za......
X.M..Ms.
17:26:50.660123 IP 10.249.7.81.mysql > 10.249.16.225.40542: Flags [.], ack 285, win 122, options [nop,nop,TS val 1486245135 ecr 21853151,nop,nop,sack 1 {284:285}], length 0
E..@..@.?...
..Q
......^..g..|>@...z.......
X.M..Ms....
.|>?.|>@
17:32:19.225421 IP 10.249.16.225.40544 > 10.249.7.81.mysql: Flags [S], seq 273871501, win 29200, options [mss 1460,sackOK,TS val 21935297 ecr 0,nop,wscale 7], length 0
E..<FL@.@..L
...
..Q.`...R........r..R.........
.N..........
17:32:19.229893 IP 10.249.7.81.mysql > 10.249.16.225.40544: Flags [S.], seq 1716340147, ack 273871502, win 14480, options [mss 1386,sackOK,TS val 1486327288 ecr 21935297,nop,wscale 7], length 0
E..<..@.?..
..Q
......`fME..R....8........j...
X....N......
17:32:19.230316 IP 10.249.16.225.40544 > 10.249.7.81.mysql: Flags [.], ack 1, win 229, options [nop,nop,TS val 21935298 ecr 1486327288], length 0
E..4FM@.@..S
...
..Q.`...R..fME......J.....
.N..X...
17:32:19.235192 IP 10.249.7.81.mysql > 10.249.16.225.40544: Flags [P.], seq 1:96, ack 1, win 114, options [nop,nop,TS val 1486327289 ecr 21935298], length 95
E....M@.?.D.
..Q
......`fME..R.....r.F.....
X....N..[...
5.5.40-0ubuntu0.12.04.1.]...-JnkP,-9...................ug#tE7$N='J!.mysql_native_password.
17:32:19.235224 IP 10.249.16.225.40544 > 10.249.7.81.mysql: Flags [.], ack 96, win 229, options [nop,nop,TS val 21935299 ecr 1486327289], length 0
E..4FN@.@..R
...
..Q.`...R..fMF......J.....
.N..X...
17:32:19.235376 IP 10.249.16.225.40544 > 10.249.7.81.mysql: Flags [P.], seq 1:98, ack 96, win 229, options [nop,nop,TS val 21935299 ecr 1486327289], length 97
E...FO@.@...
...
..Q.`...R..fMF............
.N..X...]...........!.......................aifang..J.8:fO.s.....j.,..!.newhome_db.mysql_native_password.
17:32:19.237416 IP 10.249.7.81.mysql > 10.249.16.225.40544: Flags [.], ack 98, win 114, options [nop,nop,TS val 1486327290 ecr 21935299], length 0
E..4.N@.?.ER
..Q
......`fMF..R.....rP......
X....N..
17:32:19.237435 IP 10.249.7.81.mysql > 10.249.16.225.40544: Flags [P.], seq 96:107, ack 98, win 114, options [nop,nop,TS val 1486327290 ecr 21935299], length 11
E..?.O@.?.EF
..Q
......`fMF..R.....rI......
X....N.............
17:32:19.237601 IP 10.249.16.225.40544 > 10.249.7.81.mysql: Flags [P.], seq 98:241, ack 107, win 229, options [nop,nop,TS val 21935300 ecr 1486327290], length 143
E...FP@.@...
...
..Q.`...R..fMF............
.N..X........SELECT * FROM `cms_school` WHERE `city_id` = '11' AND `type` = 'jk3oQnLB\';select pg_sleep(3); -- ' AND (status != '0') LIMIT 10 OFFSET 0 
17:32:19.240101 IP 10.249.7.81.mysql > 10.249.16.225.40544: Flags [.], seq 107:1481, ack 241, win 122, options [nop,nop,TS val 1486327291 ecr 21935300], length 1374
E....P@.?.?.
..Q
......`fMF..R.~...z.......
X....N.......8....def
newhome_db
cms_school
cms_school.id.id.?......#B...@....def
newhome_db
cms_school
cms_school.status.status.?...... ....B....def
newhome_db
cms_school
cms_school.city_id.city_id.?......)@...@....def
newhome_db
cms_school
cms_school.unikey.unikey.!.......P...<....def
newhome_db
cms_school
cms_school.type.type.?......!@...<....def
newhome_db
cms_school
cms_school.name.name.!...........>....def
newhome_db
cms_school
cms_school.alias.alias.!...........F..	.def
newhome_db
cms_school
cms_school	region_id	region_id.?......!@...B..
.def
newhome_db
cms_school
cms_school.address.address.!...........B....def
newhome_db
cms_school
cms_school.zipcode.zipcode.!...........B....def
newhome_db
cms_school
cms_school.siteurl.siteurl.!...........D...def
newhome_db
cms_school
cms_school.property.property.?......!@...F....def
newhome_db
cms_school
cms_school	attribute	attribute.!...........>....def
newhome_db
cms_school
cms_school.grade.grade.?......!@...F....def
newhome_db
cms_school
cms_school	telephone	telephone.!.<.........B....def
newhome_db
cms_school
cms_school.summary.summary.!...........>....def
newhome_db
cms_school
cms_school.range.range.!...........B....def
newhome_db
cms_school
cms_school.feature.feature.!...........R....def
newhome_db
cms_school
cms_school.feature_summary.feature_summary.!...........F....def
newhome_db
cms_school
cms_school	baidu
17:32:19.242386 IP 10.249.7.81.mysql > 10.249.16.225.40544: Flags [P.], seq 1481:2428, ack 241, win 122, options [nop,nop,TS val 1486327291 ecr 21935300], length 947
E....Q@.?.A.
..Q
......`fMK|.R.~...z.......
X....N.._lat	baidu_lat.?......!....F....def
newhome_db
cms_school
cms_school	baidu_lng	baidu_lng.?......!....:....def
newhome_db
cms_school
cms_school.lat.lat.?......!....:....def
newhome_db
cms_school
cms_school.lng.lng.?......!.............U....211.1.11.90.0.............1999..0....2..3(021)62194509....	31.207472
121.420374.0.0Y....212.1.11.delete.0.............1999..0....2..3(021)62194509....	31.207472
121.420374.0.0U....213.1.11.88.0.............1.....0....2..3(021)62194509....	31.207472
121.420374.0.0`....215.1.11.1133.01..............0....2......|.......3.021-62194509....	31.207472
121.420374.0.0g....226.1.11.11833.0e..............0....2.............|.......3.021-62194509....	31.207472
121.420374.0.0g....235.1.11.88990.0e..............0....2.............|.......3.021-62194509....	31.207472
121.420374.0.0s.. .244.1.11.88990888.0e..............0....2........3.021-62194509............|.............	31.207472
121.420374.0.0...!.....
17:32:19.242406 IP 10.249.16.225.40544 > 10.249.7.81.mysql: Flags [.], ack 2428, win 273, options [nop,nop,TS val 21935301 ecr 1486327291], length 0
E..4FQ@.@..O
...
..Q.`...R.~fMO/.....J.....
.N..X...
17:32:19.247649 IP 10.249.16.225.40544 > 10.249.7.81.mysql: Flags [P.], seq 241:246, ack 2428, win 273, options [nop,nop,TS val 21935302 ecr 1486327291], length 5
E..9FR@.@..I
...
..Q.`...R.~fMO/.....O.....
.N..X........
17:32:19.247787 IP 10.249.16.225.40544 > 10.249.7.81.mysql: Flags [F.], seq 246, ack 2428, win 273, options [nop,nop,TS val 21935302 ecr 1486327291], length 0
E..4FS@.@..M
...
..Q.`...R..fMO/.....J.....
.N..X...
17:32:19.249553 IP 10.249.7.81.mysql > 10.249.16.225.40544: Flags [F.], seq 2428, ack 246, win 122, options [nop,nop,TS val 1486327293 ecr 21935302], length 0
E..4.R@.?.EN
..Q
......`fMO/.R.....zF......
X....N..
17:32:19.249589 IP 10.249.16.225.40544 > 10.249.7.81.mysql: Flags [.], ack 2429, win 273, options [nop,nop,TS val 21935303 ecr 1486327293], length 0
E..4FT@.@..L
...
..Q.`...R..fMO0.....J.....
.N..X...
17:32:19.249672 IP 10.249.7.81.mysql > 10.249.16.225.40544: Flags [.], ack 247, win 122, options [nop,nop,TS val 1486327293 ecr 21935302], length 0
E..4.S@.?.EM
..Q
......`fMO0.R.....zF......
X....N..
17:33:37.856911 IP 10.249.16.225.40546 > 10.249.7.81.mysql: Flags [S], seq 1135921880, win 29200, options [mss 1460,sackOK,TS val 21954955 ecr 0,nop,wscale 7], length 0
E..<.S@.@.AE
...
..Q.b..C.........r..R.........
.O..........
17:33:37.859199 IP 10.249.7.81.mysql > 10.249.16.225.40546: Flags [S.], seq 2847097634, ack 1135921881, win 14480, options [mss 1386,sackOK,TS val 1486346948 ecr 21954955,nop,wscale 7], length 0
E..<..@.?..
..Q
......b..C"C.....8........j...
X....O......
17:33:37.859233 IP 10.249.16.225.40546 > 10.249.7.81.mysql: Flags [.], ack 1, win 229, options [nop,nop,TS val 21954955 ecr 1486346948], length 0
E..4.T@.@.AL
...
..Q.b..C.....C#.....J.....
.O..X...
17:33:37.864137 IP 10.249.7.81.mysql > 10.249.16.225.40546: Flags [P.], seq 1:96, ack 1, win 114, options [nop,nop,TS val 1486346949 ecr 21954955], length 95
E.....@.?.s[
..Q
......b..C#C......r.h.....
X....O..[...
5.5.40-0ubuntu0.12.04.1.....Ls{2%`86...................D3q`n){UwwpK.mysql_native_password.
17:33:37.864183 IP 10.249.16.225.40546 > 10.249.7.81.mysql: Flags [.], ack 96, win 229, options [nop,nop,TS val 21954957 ecr 1486346949], length 0
E..4.U@.@.AK
...
..Q.b..C.....C......J.....
.O..X...
17:33:37.864408 IP 10.249.16.225.40546 > 10.249.7.81.mysql: Flags [P.], seq 1:98, ack 96, win 229, options [nop,nop,TS val 21954957 ecr 1486346949], length 97
E....V@.@.@.
...
..Q.b..C.....C............
.O..X...]...........!.......................aifang...3..C&3...^...Om....newhome_db.mysql_native_password.
17:33:37.866297 IP 10.249.7.81.mysql > 10.249.16.225.40546: Flags [.], ack 98, win 114, options [nop,nop,TS val 1486346950 ecr 21954957], length 0
E..4..@.?.s.
..Q
......b..C.C..:...rj|.....
X....O..
17:33:37.866314 IP 10.249.7.81.mysql > 10.249.16.225.40546: Flags [P.], seq 96:107, ack 98, win 114, options [nop,nop,TS val 1486346950 ecr 21954957], length 11
E..?..@.?.s.
..Q
......b..C.C..:...rce.....
X....O.............
17:33:37.866408 IP 10.249.16.225.40546 > 10.249.7.81.mysql: Flags [P.], seq 98:268, ack 107, win 229, options [nop,nop,TS val 21954957 ecr 1486346950], length 170
E....W@.@.@.
...
..Q.b..C..:..C............
.O..X........SELECT * FROM `cms_school` WHERE `city_id` = '11' AND `type` = 'jk3oQnLB\';update cms_school set type = 1 where id = 211; -- ' AND (status != '0') LIMIT 10 OFFSET 0 
17:33:37.870246 IP 10.249.7.81.mysql > 10.249.16.225.40546: Flags [.], seq 107:1481, ack 268, win 122, options [nop,nop,TS val 1486346951 ecr 21954957], length 1374
E.....@.?.nY
..Q
......b..C.C......z.......
X....O.......8....def
newhome_db
cms_school
cms_school.id.id.?......#B...@....def
newhome_db
cms_school
cms_school.status.status.?...... ....B....def
newhome_db
cms_school
cms_school.city_id.city_id.?......)@...@....def
newhome_db
cms_school
cms_school.unikey.unikey.!.......P...<....def
newhome_db
cms_school
cms_school.type.type.?......!@...<....def
newhome_db
cms_school
cms_school.name.name.!...........>....def
newhome_db
cms_school
cms_school.alias.alias.!...........F..	.def
newhome_db
cms_school
cms_school	region_id	region_id.?......!@...B..
.def
newhome_db
cms_school
cms_school.address.address.!...........B....def
newhome_db
cms_school
cms_school.zipcode.zipcode.!...........B....def
newhome_db
cms_school
cms_school.siteurl.siteurl.!...........D...def
newhome_db
cms_school
cms_school.property.property.?......!@...F....def
newhome_db
cms_school
cms_school	attribute	attribute.!...........>....def
newhome_db
cms_school
cms_school.grade.grade.?......!@...F....def
newhome_db
cms_school
cms_school	telephone	telephone.!.<.........B....def
newhome_db
cms_school
cms_school.summary.summary.!...........>....def
newhome_db
cms_school
cms_school.range.range.!...........B....def
newhome_db
cms_school
cms_school.feature.feature.!...........R....def
newhome_db
cms_school
cms_school.feature_summary.feature_summary.!...........F....def
newhome_db
cms_school
cms_school	baidu
17:33:37.871302 IP 10.249.7.81.mysql > 10.249.16.225.40546: Flags [P.], seq 1481:2428, ack 268, win 122, options [nop,nop,TS val 1486346951 ecr 21954957], length 947
E.....@.?.p.
..Q
......b..H.C......z.......
X....O.._lat	baidu_lat.?......!....F....def
newhome_db
cms_school
cms_school	baidu_lng	baidu_lng.?......!....:....def
newhome_db
cms_school
cms_school.lat.lat.?......!....:....def
newhome_db
cms_school
cms_school.lng.lng.?......!.............U....211.1.11.90.0.............1999..0....2..3(021)62194509....	31.207472
121.420374.0.0Y....212.1.11.delete.0.............1999..0....2..3(021)62194509....	31.207472
121.420374.0.0U....213.1.11.88.0.............1.....0....2..3(021)62194509....	31.207472
121.420374.0.0`....215.1.11.1133.01..............0....2......|.......3.021-62194509....	31.207472
121.420374.0.0g....226.1.11.11833.0e..............0....2.............|.......3.021-62194509....	31.207472
121.420374.0.0g....235.1.11.88990.0e..............0....2.............|.......3.021-62194509....	31.207472
121.420374.0.0s.. .244.1.11.88990888.0e..............0....2........3.021-62194509............|.............	31.207472
121.420374.0.0...!.....
17:33:37.871321 IP 10.249.16.225.40546 > 10.249.7.81.mysql: Flags [.], ack 2428, win 273, options [nop,nop,TS val 21954958 ecr 1486346951], length 0
E..4.X@.@.AH
...
..Q.b..C.....L......J.....
.O..X...
17:33:37.876333 IP 10.249.16.225.40546 > 10.249.7.81.mysql: Flags [P.], seq 268:273, ack 2428, win 273, options [nop,nop,TS val 21954959 ecr 1486346951], length 5
E..9.Y@.@.AB
...
..Q.b..C.....L......O.....
.O..X........
17:33:37.876466 IP 10.249.16.225.40546 > 10.249.7.81.mysql: Flags [F.], seq 273, ack 2428, win 273, options [nop,nop,TS val 21954960 ecr 1486346951], length 0
E..4.Z@.@.AF
...
..Q.b..C.....L......J.....
.O..X...
17:33:37.879306 IP 10.249.7.81.mysql > 10.249.16.225.40546: Flags [F.], seq 2428, ack 273, win 122, options [nop,nop,TS val 1486346953 ecr 21954959], length 0
E..4..@.?.s.
..Q
......b..L.C......z`......
X....O..
17:33:37.879332 IP 10.249.16.225.40546 > 10.249.7.81.mysql: Flags [.], ack 2429, win 273, options [nop,nop,TS val 21954960 ecr 1486346953], length 0
E..4.[@.@.AE
...
..Q.b..C.....L......J.....
.O..X...
17:33:37.880870 IP 10.249.7.81.mysql > 10.249.16.225.40546: Flags [.], ack 274, win 122, options [nop,nop,TS val 1486346953 ecr 21954960], length 0
E..4..@.?.s.
..Q
......b..L.C......z`......
X....O..
17:38:03.563371 IP 10.249.16.225.40548 > 10.249.7.81.mysql: Flags [S], seq 3699103596, win 29200, options [mss 1460,sackOK,TS val 22021381 ecr 0,nop,wscale 7], length 0
E..<.i@.@.:/
...
..Q.d...{.l......r..R.........
.P..........
17:38:03.568399 IP 10.249.7.81.mysql > 10.249.16.225.40548: Flags [S.], seq 827871010, ack 3699103597, win 14480, options [mss 1386,sackOK,TS val 1486413383 ecr 22021381,nop,wscale 7], length 0
E..<..@.?..
..Q
......d1XO".{.m..8........j...
X..G.P......
17:38:03.568439 IP 10.249.16.225.40548 > 10.249.7.81.mysql: Flags [.], ack 1, win 229, options [nop,nop,TS val 22021383 ecr 1486413383], length 0
E..4.j@.@.:6
...
..Q.d...{.m1XO#.....J.....
.P..X..G
17:38:03.572629 IP 10.249.7.81.mysql > 10.249.16.225.40548: Flags [P.], seq 1:96, ack 1, win 114, options [nop,nop,TS val 1486413384 ecr 22021383], length 95
E....k@.?.{.
..Q
......d1XO#.{.m...rw......
X..H.P..[...
5.5.40-0ubuntu0.12.04.1.}...bn%h_#0g...................9&QFK("o-2Pz.mysql_native_password.
17:38:03.573007 IP 10.249.16.225.40548 > 10.249.7.81.mysql: Flags [.], ack 96, win 229, options [nop,nop,TS val 22021384 ecr 1486413384], length 0
E..4.k@.@.:5
...
..Q.d...{.m1XO......J.....
.P..X..H
17:38:03.574073 IP 10.249.16.225.40548 > 10.249.7.81.mysql: Flags [P.], seq 1:98, ack 96, win 229, options [nop,nop,TS val 22021384 ecr 1486413384], length 97
E....l@.@.9.
...
..Q.d...{.m1XO............
.P..X..H]...........!.......................aifang..bg"....../......z...newhome_db.mysql_native_password.
17:38:03.576661 IP 10.249.7.81.mysql > 10.249.16.225.40548: Flags [.], ack 98, win 114, options [nop,nop,TS val 1486413386 ecr 22021384], length 0
E..4.l@.?.|4
..Q
......d1XO..{.....r*y.....
X..J.P..
17:38:03.576697 IP 10.249.7.81.mysql > 10.249.16.225.40548: Flags [P.], seq 96:107, ack 98, win 114, options [nop,nop,TS val 1486413386 ecr 22021384], length 11
E..?.m@.?.|(
..Q
......d1XO..{.....r#b.....
X..J.P.............
17:38:03.576882 IP 10.249.16.225.40548 > 10.249.7.81.mysql: Flags [P.], seq 98:268, ack 107, win 229, options [nop,nop,TS val 22021385 ecr 1486413386], length 170
E....m@.@.9.
...
..Q.d...{..1XO............
.P.	X..J.....SELECT * FROM `cms_school` WHERE `city_id` = '11' AND `type` = 'jk3oQnLB\';update cms_school set type = 1 where id = 211; -- ' AND (status != '0') LIMIT 10 OFFSET 0 
17:38:03.580973 IP 10.249.7.81.mysql > 10.249.16.225.40548: Flags [.], seq 107:1481, ack 268, win 122, options [nop,nop,TS val 1486413387 ecr 22021385], length 1374
E....n@.?.v.
..Q
......d1XO..{.x...z}......
X..K.P.	.....8....def
newhome_db
cms_school
cms_school.id.id.?......#B...@....def
newhome_db
cms_school
cms_school.status.status.?...... ....B....def
newhome_db
cms_school
cms_school.city_id.city_id.?......)@...@....def
newhome_db
cms_school
cms_school.unikey.unikey.!.......P...<....def
newhome_db
cms_school
cms_school.type.type.?......!@...<....def
newhome_db
cms_school
cms_school.name.name.!...........>....def
newhome_db
cms_school
cms_school.alias.alias.!...........F..	.def
newhome_db
cms_school
cms_school	region_id	region_id.?......!@...B..
.def
newhome_db
cms_school
cms_school.address.address.!...........B....def
newhome_db
cms_school
cms_school.zipcode.zipcode.!...........B....def
newhome_db
cms_school
cms_school.siteurl.siteurl.!...........D...def
newhome_db
cms_school
cms_school.property.property.?......!@...F....def
newhome_db
cms_school
cms_school	attribute	attribute.!...........>....def
newhome_db
cms_school
cms_school.grade.grade.?......!@...F....def
newhome_db
cms_school
cms_school	telephone	telephone.!.<.........B....def
newhome_db
cms_school
cms_school.summary.summary.!...........>....def
newhome_db
cms_school
cms_school.range.range.!...........B....def
newhome_db
cms_school
cms_school.feature.feature.!...........R....def
newhome_db
cms_school
cms_school.feature_summary.feature_summary.!...........F....def
newhome_db
cms_school
cms_school	baidu
17:38:03.581741 IP 10.249.7.81.mysql > 10.249.16.225.40548: Flags [P.], seq 1481:2428, ack 268, win 122, options [nop,nop,TS val 1486413387 ecr 22021385], length 947
E....o@.?.x~
..Q
......d1XT..{.x...z.......
X..K.P.	_lat	baidu_lat.?......!....F....def
newhome_db
cms_school
cms_school	baidu_lng	baidu_lng.?......!....:....def
newhome_db
cms_school
cms_school.lat.lat.?......!....:....def
newhome_db
cms_school
cms_school.lng.lng.?......!.............U....211.1.11.90.0.............1999..0....2..3(021)62194509....	31.207472
121.420374.0.0Y....212.1.11.delete.0.............1999..0....2..3(021)62194509....	31.207472
121.420374.0.0U....213.1.11.88.0.............1.....0....2..3(021)62194509....	31.207472
121.420374.0.0`....215.1.11.1133.01..............0....2......|.......3.021-62194509....	31.207472
121.420374.0.0g....226.1.11.11833.0e..............0....2.............|.......3.021-62194509....	31.207472
121.420374.0.0g....235.1.11.88990.0e..............0....2.............|.......3.021-62194509....	31.207472
121.420374.0.0s.. .244.1.11.88990888.0e..............0....2........3.021-62194509............|.............	31.207472
121.420374.0.0...!.....
17:38:03.581790 IP 10.249.16.225.40548 > 10.249.7.81.mysql: Flags [.], ack 2428, win 273, options [nop,nop,TS val 22021386 ecr 1486413387], length 0
E..4.n@.@.:2
...
..Q.d...{.x1XX......J.....
.P.
X..K
17:38:03.590235 IP 10.249.16.225.40548 > 10.249.7.81.mysql: Flags [P.], seq 268:273, ack 2428, win 273, options [nop,nop,TS val 22021388 ecr 1486413387], length 5
E..9.o@.@.:,
...
..Q.d...{.x1XX......O.....
.P..X..K.....
17:38:03.590488 IP 10.249.16.225.40548 > 10.249.7.81.mysql: Flags [F.], seq 273, ack 2428, win 273, options [nop,nop,TS val 22021388 ecr 1486413387], length 0
E..4.p@.@.:0
...
..Q.d...{.}1XX......J.....
.P..X..K
17:38:03.593245 IP 10.249.7.81.mysql > 10.249.16.225.40548: Flags [F.], seq 2428, ack 273, win 122, options [nop,nop,TS val 1486413390 ecr 22021388], length 0
E..4.p@.?.|0
..Q
......d1XX..{.}...z ......
X..N.P..
17:38:03.593282 IP 10.249.16.225.40548 > 10.249.7.81.mysql: Flags [.], ack 2429, win 273, options [nop,nop,TS val 22021389 ecr 1486413390], length 0
E..4.q@.@.:/
...
..Q.d...{.~1XX......J.....
.P.X..N
17:38:03.593366 IP 10.249.7.81.mysql > 10.249.16.225.40548: Flags [.], ack 274, win 122, options [nop,nop,TS val 1486413390 ecr 22021388], length 0
E..4.q@.?.|/
..Q
......d1XX..{.~...z ......
X..N.P..
20:42:05.549597 IP 10.249.16.225.42294 > 10.249.7.81.mysql: Flags [S], seq 1562656707, win 29200, options [mss 1460,sackOK,TS val 35870288 ecr 0,nop,wscale 7], length 0
E..<i.@.@...
...
..Q.6..]$?.......r..R.........
.#VP........
20:42:05.551061 IP 10.249.7.81.mysql > 10.249.16.225.42294: Flags [S.], seq 2729280618, ack 1562656708, win 14480, options [mss 1386,sackOK,TS val 1553975012 ecr 35870288,nop,wscale 7], length 0
E..<..@.?..
..Q
......6...j]$?...8..m.....j...
\....#VP....
20:42:05.551088 IP 10.249.16.225.42294 > 10.249.7.81.mysql: Flags [.], ack 1, win 229, options [nop,nop,TS val 35870289 ecr 1553975012], length 0
E..4i.@.@...
...
..Q.6..]$?....k.....J.....
.#VQ\...
20:42:05.554693 IP 10.249.7.81.mysql > 10.249.16.225.42294: Flags [P.], seq 1:96, ack 1, win 114, options [nop,nop,TS val 1553975012 ecr 35870289], length 95
E...B.@.?...
..Q
......6...k]$?....r.......
\....#VQ[...
5.5.40-0ubuntu0.12.04.1.F...{NS8Z>d`...................5&\}%8-u,s&\.mysql_native_password.
20:42:05.554733 IP 10.249.16.225.42294 > 10.249.7.81.mysql: Flags [.], ack 96, win 229, options [nop,nop,TS val 35870290 ecr 1553975012], length 0
E..4i.@.@...
...
..Q.6..]$?..........J.....
.#VR\...
20:42:05.560873 IP 10.249.16.225.42294 > 10.249.7.81.mysql: Flags [P.], seq 1:100, ack 96, win 229, options [nop,nop,TS val 35870291 ecr 1553975012], length 99
E...i.@.@...
...
..Q.6..]$?................
.#VS\..._...................................readonly......*aM.=.yX.~2...E
newhome_db.mysql_native_password.
20:42:05.562623 IP 10.249.7.81.mysql > 10.249.16.225.42294: Flags [.], ack 100, win 114, options [nop,nop,TS val 1553975015 ecr 35870291], length 0
E..4B.@.?...
..Q
......6....]$@'...rUF.....
\....#VS
20:42:05.562660 IP 10.249.7.81.mysql > 10.249.16.225.42294: Flags [P.], seq 96:107, ack 100, win 114, options [nop,nop,TS val 1553975015 ecr 35870291], length 11
E..?B.@.?...
..Q
......6....]$@'...rN/.....
\....#VS...........
20:42:05.563677 IP 10.249.16.225.42294 > 10.249.7.81.mysql: Flags [P.], seq 100:230, ack 107, win 229, options [nop,nop,TS val 35870292 ecr 1553975015], length 130
E...i.@.@...
...
..Q.6..]$@'...............
.#VT\...~....SET NAMES utf8 #trace Apf/ApfHouseRepository.php@201	devMachine	loupan-service-server	devVersion	20180108204205	5a53671d899ba
20:42:05.564891 IP 10.249.7.81.mysql > 10.249.16.225.42294: Flags [P.], seq 107:118, ack 230, win 122, options [nop,nop,TS val 1553975015 ecr 35870292], length 11
E..?B.@.?...
..Q
......6....]$@....zM......
\....#VT...........
20:42:05.565673 IP 10.249.16.225.42294 > 10.249.7.81.mysql: Flags [P.], seq 230:364, ack 118, win 229, options [nop,nop,TS val 35870292 ecr 1553975015], length 134
E...i.@.@...
...
..Q.6..]$@................
.#VT\........set wait_timeout=2 #trace Apf/ApfHouseRepository.php@201	devMachine	loupan-service-server	devVersion	20180108204205	5a53671d8a199
20:42:05.567372 IP 10.249.7.81.mysql > 10.249.16.225.42294: Flags [P.], seq 118:129, ack 364, win 130, options [nop,nop,TS val 1553975016 ecr 35870292], length 11
E..?B.@.?...
..Q
......6....]$A/....M......
\....#VT...........
20:42:05.567555 IP 10.249.16.225.42294 > 10.249.7.81.mysql: Flags [P.], seq 364:603, ack 129, win 229, options [nop,nop,TS val 35870293 ecr 1553975016], length 239
E..#i.@.@...
...
..Q.6..]$A/......../9.....
.#VU\........SELECT `prop_id` FROM `prop_search` WHERE `is_new` = '2' AND `is_online` = '1' AND `loupan_id` = '238689' LIMIT 61 OFFSET 0 #trace Apf/ApfHouseRepository.php@201	devMachine	loupan-service-server	devVersion	20180108204205	5a53671d73c75
20:42:05.572498 IP 10.249.7.81.mysql > 10.249.16.225.42294: Flags [P.], seq 129:260, ack 603, win 139, options [nop,nop,TS val 1553975017 ecr 35870293], length 131
E...B.@.?...
..Q
......6....]$B.....B^.....
\....#VU.....D....def
newhome_db.prop_search.prop_search.prop_id.prop_id.?.......P.................7929403.....7929404.....7929405.........
20:42:05.610609 IP 10.249.16.225.42294 > 10.249.7.81.mysql: Flags [.], ack 260, win 237, options [nop,nop,TS val 35870304 ecr 1553975017], length 0
E..4i.@.@...
...
..Q.6..]$B....n.....J.....
.#V`\...
20:42:06.067221 IP 10.249.16.225.42294 > 10.249.7.81.mysql: Flags [P.], seq 603:608, ack 260, win 237, options [nop,nop,TS val 35870418 ecr 1553975017], length 5
E..9i.@.@...
...
..Q.6..]$B....n.....O.....
.#V.\........
20:42:06.067274 IP 10.249.16.225.42294 > 10.249.7.81.mysql: Flags [F.], seq 608, ack 260, win 237, options [nop,nop,TS val 35870418 ecr 1553975017], length 0
E..4i.@.@...
...
..Q.6..]$B#...n.....J.....
.#V.\...
20:42:06.069669 IP 10.249.7.81.mysql > 10.249.16.225.42294: Flags [F.], seq 260, ack 609, win 139, options [nop,nop,TS val 1553975141 ecr 35870418], length 0
E..4B.@.?...
..Q
......6...n]$B$....Q......
\..e.#V.
20:42:06.069694 IP 10.249.16.225.42294 > 10.249.7.81.mysql: Flags [.], ack 261, win 237, options [nop,nop,TS val 35870418 ecr 1553975141], length 0
E..4i.@.@...
...
..Q.6..]$B$...o.....J.....
.#V.\..e
20:43:46.416260 IP 10.249.16.225.42302 > 10.249.7.81.mysql: Flags [S], seq 3072642881, win 29200, options [mss 1460,sackOK,TS val 35895505 ecr 0,nop,wscale 7], length 0
E..<w.@.@...
...
..Q.>...$.A......r..R.........
.#..........
20:43:46.418051 IP 10.249.7.81.mysql > 10.249.16.225.42302: Flags [S.], seq 3124039921, ack 3072642882, win 14480, options [mss 1386,sackOK,TS val 1554000232 ecr 35895505,nop,wscale 7], length 0
E..<..@.?..
..Q
......>.5...$.B..8........j...
\.)h.#......
20:43:46.418153 IP 10.249.16.225.42302 > 10.249.7.81.mysql: Flags [.], ack 1, win 229, options [nop,nop,TS val 35895505 ecr 1554000232], length 0
E..4w.@.@...
...
..Q.>...$.B.5.......J.....
.#..\.)h
20:43:46.420122 IP 10.249.7.81.mysql > 10.249.16.225.42302: Flags [P.], seq 1:96, ack 1, win 114, options [nop,nop,TS val 1554000232 ecr 35895505], length 95
E...9.@.?...
..Q
......>.5...$.B...r5|.....
\.)h.#..[...
5.5.40-0ubuntu0.12.04.1.M!..1/8i,:"9...................9Pg8!9;\@giW.mysql_native_password.
20:43:46.420157 IP 10.249.16.225.42302 > 10.249.7.81.mysql: Flags [.], ack 96, win 229, options [nop,nop,TS val 35895506 ecr 1554000232], length 0
E..4w.@.@...
...
..Q.>...$.B.5.Q.....J.....
.#..\.)h
20:43:46.420264 IP 10.249.16.225.42302 > 10.249.7.81.mysql: Flags [P.], seq 1:100, ack 96, win 229, options [nop,nop,TS val 35895506 ecr 1554000232], length 99
E...w.@.@...
...
..Q.>...$.B.5.Q...........
.#..\.)h_...................................readonly............l0R..!).u{newhome_db.mysql_native_password.
20:43:46.422573 IP 10.249.7.81.mysql > 10.249.16.225.42302: Flags [.], ack 100, win 114, options [nop,nop,TS val 1554000233 ecr 35895506], length 0
E..49.@.?...
..Q
......>.5.Q.$.....r.......
\.)i.#..
20:43:46.422596 IP 10.249.7.81.mysql > 10.249.16.225.42302: Flags [P.], seq 96:107, ack 100, win 114, options [nop,nop,TS val 1554000233 ecr 35895506], length 11
E..?9.@.?...
..Q
......>.5.Q.$.....r.......
\.)i.#.............
20:43:46.423961 IP 10.249.16.225.42302 > 10.249.7.81.mysql: Flags [P.], seq 100:230, ack 107, win 229, options [nop,nop,TS val 35895507 ecr 1554000233], length 130
E...w.@.@...
...
..Q.>...$...5.\...........
.#..\.)i~....SET NAMES utf8 #trace Apf/ApfHouseRepository.php@202	devMachine	loupan-service-server	devVersion	20180108204346	5a536782677e9
20:43:46.426081 IP 10.249.7.81.mysql > 10.249.16.225.42302: Flags [P.], seq 107:118, ack 230, win 122, options [nop,nop,TS val 1554000234 ecr 35895507], length 11
E..?9.@.?...
..Q
......>.5.\.$.'...z.......
\.)j.#.............
20:43:46.426843 IP 10.249.16.225.42302 > 10.249.7.81.mysql: Flags [P.], seq 230:364, ack 118, win 229, options [nop,nop,TS val 35895508 ecr 1554000234], length 134
E...w.@.@...
...
..Q.>...$.'.5.g...........
.#..\.)j.....set wait_timeout=2 #trace Apf/ApfHouseRepository.php@202	devMachine	loupan-service-server	devVersion	20180108204346	5a536782682b6
20:43:46.428906 IP 10.249.7.81.mysql > 10.249.16.225.42302: Flags [P.], seq 118:129, ack 364, win 130, options [nop,nop,TS val 1554000235 ecr 35895508], length 11
E..?9.@.?...
..Q
......>.5.g.$.......f.....
\.)k.#.............
20:43:46.429163 IP 10.249.16.225.42302 > 10.249.7.81.mysql: Flags [P.], seq 364:603, ack 129, win 229, options [nop,nop,TS val 35895508 ecr 1554000235], length 239
E..#w.@.@...
...
..Q.>...$...5.r..../9.....
.#..\.)k.....SELECT `prop_id` FROM `prop_search` WHERE `is_new` = '2' AND `is_online` = '1' AND `loupan_id` = '238689' LIMIT 61 OFFSET 0 #trace Apf/ApfHouseRepository.php@202	devMachine	loupan-service-server	devVersion	20180108204346	5a536782648e5
20:43:46.433203 IP 10.249.7.81.mysql > 10.249.16.225.42302: Flags [P.], seq 129:260, ack 603, win 139, options [nop,nop,TS val 1554000235 ecr 35895508], length 131
E...9.@.?..~
..Q
......>.5.r.$.............
\.)k.#.......D....def
newhome_db.prop_search.prop_search.prop_id.prop_id.?.......P.................7929403.....7929404.....7929405.........
20:43:46.436031 IP 10.249.16.225.42302 > 10.249.7.81.mysql: Flags [P.], seq 603:608, ack 260, win 237, options [nop,nop,TS val 35895510 ecr 1554000235], length 5
E..9w.@.@...
...
..Q.>...$...5.......O.....
.#..\.)k.....
20:43:46.436085 IP 10.249.16.225.42302 > 10.249.7.81.mysql: Flags [F.], seq 608, ack 260, win 237, options [nop,nop,TS val 35895510 ecr 1554000235], length 0
E..4w.@.@...
...
..Q.>...$...5.......J.....
.#..\.)k
20:43:46.439721 IP 10.249.7.81.mysql > 10.249.16.225.42302: Flags [F.], seq 260, ack 609, win 139, options [nop,nop,TS val 1554000237 ecr 35895510], length 0
E..49.@.?...
..Q
......>.5...$.............
\.)m.#..
20:43:46.439743 IP 10.249.16.225.42302 > 10.249.7.81.mysql: Flags [.], ack 261, win 237, options [nop,nop,TS val 35895511 ecr 1554000237], length 0
E..4w.@.@...
...
..Q.>...$...5.......J.....
.#..\.)m
20:44:17.445548 IP 10.249.16.225.42310 > 10.249.7.81.mysql: Flags [S], seq 735976234, win 29200, options [mss 1460,sackOK,TS val 35903262 ecr 0,nop,wscale 7], length 0
E..<.4@.@.@d
...
..Q.F..+..*......r..R.........
.#..........
20:44:17.446960 IP 10.249.7.81.mysql > 10.249.16.225.42310: Flags [S.], seq 974029082, ack 735976235, win 14480, options [mss 1386,sackOK,TS val 1554007990 ecr 35903262,nop,wscale 7], length 0
E..<..@.?..
..Q
......F:...+..+..8........j...
\.G..#......
20:44:17.447027 IP 10.249.16.225.42310 > 10.249.7.81.mysql: Flags [.], ack 1, win 229, options [nop,nop,TS val 35903263 ecr 1554007990], length 0
E..4.5@.@.@k
...
..Q.F..+..+:........J.....
.#..\.G.
20:44:17.449013 IP 10.249.7.81.mysql > 10.249.16.225.42310: Flags [P.], seq 1:96, ack 1, win 114, options [nop,nop,TS val 1554007991 ecr 35903263], length 95
E.....@.?.F.
..Q
......F:...+..+...r.{.....
\.G..#..[...
5.5.40-0ubuntu0.12.04.1.w#..LESR"PLm...................a~tL_wX4;k+2.mysql_native_password.
20:44:17.449045 IP 10.249.16.225.42310 > 10.249.7.81.mysql: Flags [.], ack 96, win 229, options [nop,nop,TS val 35903263 ecr 1554007991], length 0
E..4.6@.@.@j
...
..Q.F..+..+:..z.....J.....
.#..\.G.
20:44:17.449160 IP 10.249.16.225.42310 > 10.249.7.81.mysql: Flags [P.], seq 1:100, ack 96, win 229, options [nop,nop,TS val 35903263 ecr 1554007991], length 99
E....7@.@.@.
...
..Q.F..+..+:..z...........
.#..\.G._...................................readonly..}.|..,l....t.X0..0efnewhome_db.mysql_native_password.
20:44:17.450642 IP 10.249.7.81.mysql > 10.249.16.225.42310: Flags [.], ack 100, win 114, options [nop,nop,TS val 1554007991 ecr 35903263], length 0
E..4..@.?.F.
..Q
......F:..z+......r.h.....
\.G..#..
20:44:17.450785 IP 10.249.7.81.mysql > 10.249.16.225.42310: Flags [P.], seq 96:107, ack 100, win 114, options [nop,nop,TS val 1554007991 ecr 35903263], length 11
E..?..@.?.F.
..Q
......F:..z+......r.Q.....
\.G..#.............
20:44:17.451639 IP 10.249.16.225.42310 > 10.249.7.81.mysql: Flags [P.], seq 100:230, ack 107, win 229, options [nop,nop,TS val 35903264 ecr 1554007991], length 130
E....8@.@.?.
...
..Q.F..+...:..............
.#. \.G.~....SET NAMES utf8 #trace Apf/ApfHouseRepository.php@202	devMachine	loupan-service-server	devVersion	20180108204417	5a5367a16e413
20:44:17.453638 IP 10.249.7.81.mysql > 10.249.16.225.42310: Flags [P.], seq 107:118, ack 230, win 122, options [nop,nop,TS val 1554007992 ecr 35903264], length 11
E..?..@.?.F.
..Q
......F:...+......z......
\.G..#. ...........
20:44:17.454691 IP 10.249.16.225.42310 > 10.249.7.81.mysql: Flags [P.], seq 230:364, ack 118, win 229, options [nop,nop,TS val 35903265 ecr 1554007992], length 134
E....9@.@.?.
...
..Q.F..+...:..............
.#.!\.G......set wait_timeout=2 #trace Apf/ApfHouseRepository.php@202	devMachine	loupan-service-server	devVersion	20180108204417	5a5367a16f012
20:44:17.456628 IP 10.249.7.81.mysql > 10.249.16.225.42310: Flags [P.], seq 118:129, ack 364, win 130, options [nop,nop,TS val 1554007993 ecr 35903265], length 11
E..?..@.?.F.
..Q
......F:...+....... .....
\.G..#.!...........
20:44:17.456796 IP 10.249.16.225.42310 > 10.249.7.81.mysql: Flags [P.], seq 364:603, ack 129, win 229, options [nop,nop,TS val 35903265 ecr 1554007993], length 239
E..#.:@.@.?w
...
..Q.F..+...:......./9.....
.#.!\.G......SELECT `prop_id` FROM `prop_search` WHERE `is_new` = '2' AND `is_online` = '1' AND `loupan_id` = '238689' LIMIT 61 OFFSET 0 #trace Apf/ApfHouseRepository.php@202	devMachine	loupan-service-server	devVersion	20180108204417	5a5367a16b540
20:44:17.462356 IP 10.249.7.81.mysql > 10.249.16.225.42310: Flags [P.], seq 129:260, ack 603, win 139, options [nop,nop,TS val 1554007993 ecr 35903265], length 131
E.....@.?.Fl
..Q
......F:...+..............
\.G..#.!.....D....def
newhome_db.prop_search.prop_search.prop_id.prop_id.?.......P.................7929403.....7929404.....7929405.........
20:44:17.465070 IP 10.249.16.225.42310 > 10.249.7.81.mysql: Flags [P.], seq 603:608, ack 260, win 237, options [nop,nop,TS val 35903267 ecr 1554007993], length 5
E..9.;@.@.@`
...
..Q.F..+...:........O.....
.#.#\.G......
20:44:17.465125 IP 10.249.16.225.42310 > 10.249.7.81.mysql: Flags [F.], seq 608, ack 260, win 237, options [nop,nop,TS val 35903267 ecr 1554007993], length 0
E..4.<@.@.@d
...
..Q.F..+...:........J.....
.#.#\.G.
20:44:17.466707 IP 10.249.7.81.mysql > 10.249.16.225.42310: Flags [F.], seq 260, ack 609, win 139, options [nop,nop,TS val 1554007995 ecr 35903267], length 0
E..4..@.?.F.
..Q
......F:...+..............
\.G..#.#
20:44:17.466736 IP 10.249.16.225.42310 > 10.249.7.81.mysql: Flags [.], ack 261, win 237, options [nop,nop,TS val 35903268 ecr 1554007995], length 0
E..4.=@.@.@c
...
..Q.F..+...:........J.....
.#.$\.G.
20:45:26.140687 IP 10.249.16.225.42316 > 10.249.7.81.mysql: Flags [S], seq 3978724230, win 29200, options [mss 1460,sackOK,TS val 35920436 ecr 0,nop,wscale 7], length 0
E..<..@.@.r.
...
..Q.L...&........r..R.........
.$.4........
20:45:26.142132 IP 10.249.7.81.mysql > 10.249.16.225.42316: Flags [S.], seq 3292890832, ack 3978724231, win 14480, options [mss 1386,sackOK,TS val 1554025166 ecr 35920436,nop,wscale 7], length 0
E..<..@.?..
..Q
......L.E...&....8.o......j...
\....$.4....
20:45:26.142152 IP 10.249.16.225.42316 > 10.249.7.81.mysql: Flags [.], ack 1, win 229, options [nop,nop,TS val 35920436 ecr 1554025166], length 0
E..4..@.@.r.
...
..Q.L...&...E.......J.....
.$.4\...
20:45:26.144155 IP 10.249.7.81.mysql > 10.249.16.225.42316: Flags [P.], seq 1:96, ack 1, win 114, options [nop,nop,TS val 1554025167 ecr 35920436], length 95
E.....@.?..$
..Q
......L.E...&.....rP......
\....$.4[...
5.5.40-0ubuntu0.12.04.1..(..br7W4<pB...................6)iX[Ar=uX8L.mysql_native_password.
20:45:26.144167 IP 10.249.16.225.42316 > 10.249.7.81.mysql: Flags [.], ack 96, win 229, options [nop,nop,TS val 35920437 ecr 1554025167], length 0
E..4..@.@.r.
...
..Q.L...&...E.0.....J.....
.$.5\...
20:45:26.144260 IP 10.249.16.225.42316 > 10.249.7.81.mysql: Flags [P.], seq 1:100, ack 96, win 229, options [nop,nop,TS val 35920437 ecr 1554025167], length 99
E.....@.@.r.
...
..Q.L...&...E.0...........
.$.5\..._...................................readonly...1..u.gt.
..9V...x..newhome_db.mysql_native_password.
20:45:26.145814 IP 10.249.7.81.mysql > 10.249.16.225.42316: Flags [.], ack 100, win 114, options [nop,nop,TS val 1554025167 ecr 35920437], length 0
E..4..@.?...
..Q
......L.E.0.&.....r.......
\....$.5
20:45:26.145821 IP 10.249.7.81.mysql > 10.249.16.225.42316: Flags [P.], seq 96:107, ack 100, win 114, options [nop,nop,TS val 1554025167 ecr 35920437], length 11
E..?. @.?..v
..Q
......L.E.0.&.....r.......
\....$.5...........
20:45:26.146790 IP 10.249.16.225.42316 > 10.249.7.81.mysql: Flags [P.], seq 100:230, ack 107, win 229, options [nop,nop,TS val 35920438 ecr 1554025167], length 130
E.....@.@.rh
...
..Q.L...&...E.;...........
.$.6\...~....SET NAMES utf8 #trace Apf/ApfHouseRepository.php@202	devMachine	loupan-service-server	devVersion	20180108204526	5a5367e623d2e
20:45:26.148287 IP 10.249.7.81.mysql > 10.249.16.225.42316: Flags [P.], seq 107:118, ack 230, win 122, options [nop,nop,TS val 1554025168 ecr 35920438], length 11
E..?.!@.?..u
..Q
......L.E.;.&.l...z.......
\....$.6...........
20:45:26.148814 IP 10.249.16.225.42316 > 10.249.7.81.mysql: Flags [P.], seq 230:364, ack 118, win 229, options [nop,nop,TS val 35920438 ecr 1554025168], length 134
E.....@.@.rc
...
..Q.L...&.l.E.F...........
.$.6\........set wait_timeout=2 #trace Apf/ApfHouseRepository.php@202	devMachine	loupan-service-server	devVersion	20180108204526	5a5367e624515
20:45:26.150419 IP 10.249.7.81.mysql > 10.249.16.225.42316: Flags [P.], seq 118:129, ack 364, win 130, options [nop,nop,TS val 1554025168 ecr 35920438], length 11
E..?."@.?..t
..Q
......L.E.F.&.......Z.....
\....$.6...........
20:45:26.150495 IP 10.249.16.225.42316 > 10.249.7.81.mysql: Flags [P.], seq 364:603, ack 129, win 229, options [nop,nop,TS val 35920439 ecr 1554025168], length 239
E..#..@.@.q.
...
..Q.L...&...E.Q..../9.....
.$.7\........SELECT `prop_id` FROM `prop_search` WHERE `is_new` = '2' AND `is_online` = '1' AND `loupan_id` = '238689' LIMIT 61 OFFSET 0 #trace Apf/ApfHouseRepository.php@202	devMachine	loupan-service-server	devVersion	20180108204526	5a5367e621632
20:45:26.154878 IP 10.249.7.81.mysql > 10.249.16.225.42316: Flags [P.], seq 129:260, ack 603, win 139, options [nop,nop,TS val 1554025169 ecr 35920439], length 131
E....#@.?...
..Q
......L.E.Q.&.............
\....$.7.....D....def
newhome_db.prop_search.prop_search.prop_id.prop_id.?.......P.................7929403.....7929404.....7929405.........
20:45:26.157353 IP 10.249.16.225.42316 > 10.249.7.81.mysql: Flags [P.], seq 603:608, ack 260, win 237, options [nop,nop,TS val 35920440 ecr 1554025169], length 5
E..9..@.@.r.
...
..Q.L...&...E.......O.....
.$.8\........
20:45:26.157410 IP 10.249.16.225.42316 > 10.249.7.81.mysql: Flags [F.], seq 608, ack 260, win 237, options [nop,nop,TS val 35920440 ecr 1554025169], length 0
E..4..@.@.r.
...
..Q.L...&...E.......J.....
.$.8\...
20:45:26.159581 IP 10.249.7.81.mysql > 10.249.16.225.42316: Flags [F.], seq 260, ack 609, win 139, options [nop,nop,TS val 1554025170 ecr 35920440], length 0
E..4.$@.?..}
..Q
......L.E...&.............
\....$.8
20:45:26.159612 IP 10.249.16.225.42316 > 10.249.7.81.mysql: Flags [.], ack 261, win 237, options [nop,nop,TS val 35920441 ecr 1554025170], length 0
E..4..@.@.r.
...
..Q.L...&...E.......J.....
.$.9\...
20:46:15.648141 IP 10.249.16.225.42322 > 10.249.7.81.mysql: Flags [S], seq 4000664275, win 29200, options [mss 1460,sackOK,TS val 35932813 ecr 0,nop,wscale 7], length 0
E..<.^@.@..;
...
..Q.R...uJ.......r..R.........
.$J.........
20:46:15.649852 IP 10.249.7.81.mysql > 10.249.16.225.42322: Flags [S.], seq 2011522859, ack 4000664276, win 14480, options [mss 1386,sackOK,TS val 1554037545 ecr 35932813,nop,wscale 7], length 0
E..<..@.?..
..Q
......Rw.g+.uJ...8..s.....j...
\..).$J.....
20:46:15.649886 IP 10.249.16.225.42322 > 10.249.7.81.mysql: Flags [.], ack 1, win 229, options [nop,nop,TS val 35932813 ecr 1554037545], length 0
E..4._@.@..B
...
..Q.R...uJ.w.g,.....J.....
.$J.\..)
20:46:15.651937 IP 10.249.7.81.mysql > 10.249.16.225.42322: Flags [P.], seq 1:96, ack 1, win 114, options [nop,nop,TS val 1554037545 ecr 35932813], length 95
E.....@.?.1<
..Q
......Rw.g,.uJ....r.......
\..).$J.[...
5.5.40-0ubuntu0.12.04.1..+..$lu*nmWL...................YW,qx'TS&a6+.mysql_native_password.
20:46:15.651967 IP 10.249.16.225.42322 > 10.249.7.81.mysql: Flags [.], ack 96, win 229, options [nop,nop,TS val 35932814 ecr 1554037545], length 0
E..4.`@.@..A
...
..Q.R...uJ.w.g......J.....
.$J.\..)
20:46:15.652098 IP 10.249.16.225.42322 > 10.249.7.81.mysql: Flags [P.], seq 1:100, ack 96, win 229, options [nop,nop,TS val 35932814 ecr 1554037545], length 99
E....a@.@...
...
..Q.R...uJ.w.g............
.$J.\..)_...................................readonly....Lg...WJp....|....?newhome_db.mysql_native_password.
20:46:15.653707 IP 10.249.7.81.mysql > 10.249.16.225.42322: Flags [.], ack 100, win 114, options [nop,nop,TS val 1554037546 ecr 35932814], length 0
E..4..@.?.1.
..Q
......Rw.g..uK7...r.P.....
\..*.$J.
20:46:15.653848 IP 10.249.7.81.mysql > 10.249.16.225.42322: Flags [P.], seq 96:107, ack 100, win 114, options [nop,nop,TS val 1554037546 ecr 35932814], length 11
E..?..@.?.1.
..Q
......Rw.g..uK7...r.9.....
\..*.$J............
20:46:15.654450 IP 10.249.16.225.42322 > 10.249.7.81.mysql: Flags [P.], seq 100:230, ack 107, win 229, options [nop,nop,TS val 35932815 ecr 1554037546], length 130
E....b@.@...
...
..Q.R...uK7w.g............
.$J.\..*~....SET NAMES utf8 #trace Apf/ApfHouseRepository.php@201	devMachine	loupan-service-server	devVersion	20180108204615	5a5368179fc5d
20:46:15.659322 IP 10.249.7.81.mysql > 10.249.16.225.42322: Flags [P.], seq 107:118, ack 230, win 122, options [nop,nop,TS val 1554037546 ecr 35932815], length 11
E..?..@.?.1.
..Q
......Rw.g..uK....z.......
\..*.$J............
20:46:15.660387 IP 10.249.16.225.42322 > 10.249.7.81.mysql: Flags [P.], seq 230:364, ack 118, win 229, options [nop,nop,TS val 35932816 ecr 1554037546], length 134
E....c@.@...
...
..Q.R...uK.w.g............
.$J.\..*.....set wait_timeout=2 #trace Apf/ApfHouseRepository.php@201	devMachine	loupan-service-server	devVersion	20180108204615	5a536817a137f
20:46:15.662180 IP 10.249.7.81.mysql > 10.249.16.225.42322: Flags [P.], seq 118:129, ack 364, win 130, options [nop,nop,TS val 1554037548 ecr 35932816], length 11
E..?.	@.?.1.
..Q
......Rw.g..uL?...........
\..,.$J............
20:46:15.662483 IP 10.249.16.225.42322 > 10.249.7.81.mysql: Flags [P.], seq 364:603, ack 129, win 229, options [nop,nop,TS val 35932817 ecr 1554037548], length 239
E..#.d@.@..N
...
..Q.R...uL?w.g...../9.....
.$J.\..,.....SELECT `prop_id` FROM `prop_search` WHERE `is_new` = '2' AND `is_online` = '1' AND `loupan_id` = '238689' LIMIT 61 OFFSET 0 #trace Apf/ApfHouseRepository.php@201	devMachine	loupan-service-server	devVersion	20180108204615	5a5368179d58b
20:46:15.665046 IP 10.249.7.81.mysql > 10.249.16.225.42322: Flags [P.], seq 129:260, ack 603, win 139, options [nop,nop,TS val 1554037548 ecr 35932817], length 131
E....
@.?.1.
..Q
......Rw.g..uM......g.....
\..,.$J......D....def
newhome_db.prop_search.prop_search.prop_id.prop_id.?.......P.................7929403.....7929404.....7929405.........
20:46:15.667957 IP 10.249.16.225.42322 > 10.249.7.81.mysql: Flags [P.], seq 603:608, ack 260, win 237, options [nop,nop,TS val 35932818 ecr 1554037548], length 5
E..9.e@.@..7
...
..Q.R...uM.w.h/.....O.....
.$J.\..,.....
20:46:15.668029 IP 10.249.16.225.42322 > 10.249.7.81.mysql: Flags [F.], seq 608, ack 260, win 237, options [nop,nop,TS val 35932818 ecr 1554037548], length 0
E..4.f@.@..;
...
..Q.R...uM3w.h/.....J.....
.$J.\..,
20:46:15.669658 IP 10.249.7.81.mysql > 10.249.16.225.42322: Flags [F.], seq 260, ack 609, win 139, options [nop,nop,TS val 1554037550 ecr 35932818], length 0
E..4..@.?.1.
..Q
......Rw.h/.uM4...........
\....$J.
20:46:15.669690 IP 10.249.16.225.42322 > 10.249.7.81.mysql: Flags [.], ack 261, win 237, options [nop,nop,TS val 35932818 ecr 1554037550], length 0
E..4.g@.@..:
...
..Q.R...uM4w.h0.....J.....
.$J.\...
20:48:04.542990 IP 10.249.16.225.42332 > 10.249.7.81.mysql: Flags [S], seq 2494725778, win 29200, options [mss 1460,sackOK,TS val 35960037 ecr 0,nop,wscale 7], length 0
E..<.w@.@.B!
...
..Q.\....~.......r..R.........
.$..........
20:48:04.544320 IP 10.249.7.81.mysql > 10.249.16.225.42332: Flags [S.], seq 2707408920, ack 2494725779, win 14480, options [mss 1386,sackOK,TS val 1554064772 ecr 35960037,nop,wscale 7], length 0
E..<..@.?..
..Q
......\._....~...8.yR.....j...
\.%..$......
20:48:04.544351 IP 10.249.16.225.42332 > 10.249.7.81.mysql: Flags [.], ack 1, win 229, options [nop,nop,TS val 35960037 ecr 1554064772], length 0
E..4.x@.@.B(
...
..Q.\....~.._.......J.....
.$..\.%.
20:48:04.546472 IP 10.249.7.81.mysql > 10.249.16.225.42332: Flags [P.], seq 1:96, ack 1, win 114, options [nop,nop,TS val 1554064772 ecr 35960037], length 95
E.....@.?...
..Q
......\._....~....r.K.....
\.%..$..[...
5.5.40-0ubuntu0.12.04.1..3..Nc)>?aL8...................qR(kf>Bo)|X$.mysql_native_password.
20:48:04.546504 IP 10.249.16.225.42332 > 10.249.7.81.mysql: Flags [.], ack 96, win 229, options [nop,nop,TS val 35960038 ecr 1554064772], length 0
E..4.y@.@.B'
...
..Q.\....~.._.x.....J.....
.$..\.%.
20:48:04.546644 IP 10.249.16.225.42332 > 10.249.7.81.mysql: Flags [P.], seq 1:100, ack 96, win 229, options [nop,nop,TS val 35960038 ecr 1554064772], length 99
E....z@.@.A.
...
..Q.\....~.._.x...........
.$..\.%._...................................readonly..|.+B..C5m9.. z.<04..newhome_db.mysql_native_password.
20:48:04.548265 IP 10.249.7.81.mysql > 10.249.16.225.42332: Flags [.], ack 100, win 114, options [nop,nop,TS val 1554064773 ecr 35960038], length 0
E..4..@.?. .
..Q
......\._.x..~....r.......
\.%..$..
20:48:04.548278 IP 10.249.7.81.mysql > 10.249.16.225.42332: Flags [P.], seq 96:107, ack 100, win 114, options [nop,nop,TS val 1554064773 ecr 35960038], length 11
E..?..@.?...
..Q
......\._.x..~....r.......
\.%..$.............
20:48:04.549467 IP 10.249.16.225.42332 > 10.249.7.81.mysql: Flags [P.], seq 100:230, ack 107, win 229, options [nop,nop,TS val 35960038 ecr 1554064773], length 130
E....{@.@.A.
...
..Q.\....~.._.............
.$..\.%.~....SET NAMES utf8 #trace Apf/ApfHouseRepository.php@204	devMachine	loupan-service-server	devVersion	20180108204804	5a53688486235
20:48:04.550923 IP 10.249.7.81.mysql > 10.249.16.225.42332: Flags [P.], seq 107:118, ack 230, win 122, options [nop,nop,TS val 1554064773 ecr 35960038], length 11
E..?..@.?...
..Q
......\._.....x...z.......
\.%..$.............
20:48:04.551482 IP 10.249.16.225.42332 > 10.249.7.81.mysql: Flags [P.], seq 230:364, ack 118, win 229, options [nop,nop,TS val 35960039 ecr 1554064773], length 134
E....|@.@.A.
...
..Q.\.....x._.............
.$..\.%......set wait_timeout=2 #trace Apf/ApfHouseRepository.php@204	devMachine	loupan-service-server	devVersion	20180108204804	5a53688486a2b
20:48:04.552934 IP 10.249.7.81.mysql > 10.249.16.225.42332: Flags [P.], seq 118:129, ack 364, win 130, options [nop,nop,TS val 1554064774 ecr 35960039], length 11
E..?..@.?...
..Q
......\._.................
\.%..$.............
20:48:04.553080 IP 10.249.16.225.42332 > 10.249.7.81.mysql: Flags [P.], seq 364:629, ack 129, win 229, options [nop,nop,TS val 35960039 ecr 1554064774], length 265
E..=.}@.@.A.
...
..Q.\......._....../S.....
.$..\.%......SELECT `prop_id` FROM `prop_search` WHERE `is_new` = '2' AND `is_online` = '1' AND `loupan_id` = '238689' ORDER BY `published` DESC LIMIT 61 OFFSET 0 #trace Apf/ApfHouseRepository.php@204	devMachine	loupan-service-server	devVersion	20180108204804	5a53688483aef
20:48:04.556667 IP 10.249.7.81.mysql > 10.249.16.225.42332: Flags [P.], seq 129:260, ack 629, win 139, options [nop,nop,TS val 1554064775 ecr 35960039], length 131
E.....@.?..{
..Q
......\._...........-.....
\.%..$.......D....def
newhome_db.prop_search.prop_search.prop_id.prop_id.?.......P.................7929405.....7929404.....7929403.........
20:48:04.567634 IP 10.249.16.225.42332 > 10.249.7.81.mysql: Flags [P.], seq 629:634, ack 260, win 237, options [nop,nop,TS val 35960043 ecr 1554064775], length 5
E..9.~@.@.B.
...
..Q.\......._.......O.....
.$..\.%......
20:48:04.567700 IP 10.249.16.225.42332 > 10.249.7.81.mysql: Flags [F.], seq 634, ack 260, win 237, options [nop,nop,TS val 35960043 ecr 1554064775], length 0
E..4..@.@.B!
...
..Q.\......._.......J.....
.$..\.%.
20:48:04.578317 IP 10.249.16.225.42332 > 10.249.7.81.mysql: Flags [F.], seq 634, ack 260, win 237, options [nop,nop,TS val 35960046 ecr 1554064775], length 0
E..4..@.@.B 
...
..Q.\......._.......J.....
.$..\.%.
20:48:04.582552 IP 10.249.7.81.mysql > 10.249.16.225.42332: Flags [F.], seq 260, ack 635, win 139, options [nop,nop,TS val 1554064778 ecr 35960043], length 0
E..4..@.?...
..Q
......\._..........O.....
\.%..$..
20:48:04.582560 IP 10.249.16.225.42332 > 10.249.7.81.mysql: Flags [.], ack 261, win 237, options [nop,nop,TS val 35960047 ecr 1554064778], length 0
E..4..@.@.B.
...
..Q.\......_.......J.....
.$..\.%.
20:48:04.583698 IP 10.249.7.81.mysql > 10.249.16.225.42332: Flags [.], ack 635, win 139, options [nop,nop,TS val 1554064782 ecr 35960046,nop,nop,sack 1 {634:635}], length 0
E..@..@.?...
..Q
......\._.........z......
\.%..$.....
.......

